organisation,transparency_reg_id,source_date,meetings_total,meetings_commission,meetings_ep,amendment_number,target_element,target_type,committee,similarity_score,provision_effect,label,reasoning,n_chunks,conflict
EUROBAT,39573492614-61,2023-11-09,2,0,2,372,Recital 57,recital,CJ45,0.867427,The amendment adds a condition to the exclusion of EV batteries from essential parts: the last owner must provide documentation proving the battery was handled by a professional operator in accordance with Regulation (EU) 2023/1542.,ALIGNED,"EUROBAT explicitly calls for alignment between the ELV Regulation and the Batteries Regulation (EU) 2023/1542, and emphasizes the importance of ""uniform and environmentally sound end-of-life treatment of batteries from vehicles."" The amendment directly strengthens alignment with Regulation (EU) 2023/1542 by requiring documentation of professional handling under that regulation as a condition for removing EV batteries before vehicle treatment — responding specifically to EUROBAT's advocacy for closer regulatory alignment and sound battery end-of-life management.",1,False
EUROBAT,39573492614-61,2023-11-09,2,0,2,373,Recital 57,recital,CJ45,0.862049,"The amendment replaces the placeholder citation ""Regulation (EU)2023/[Batteries]"" with the specific citation ""Regulation (EU)2023/1542"", without changing any substantive content of the recital.",NOISE,"The amendment makes only a technical/editorial change — inserting the final regulation number for the Batteries Regulation — with no substantive policy change. EUROBAT's position focuses on alignment between the ELV Regulation and the Batteries Regulation regarding substance restrictions and battery second life, but does not advocate for or against this purely formal citation update. No directional advocacy position is relevant here.",1,False
EUROBAT,39573492614-61,2023-11-09,2,0,2,1246,Article 24 – paragraph 2,article,CJ45,0.857096,"The amendment adds a condition that free delivery of an ELV without its electric vehicle battery is only permitted if the last owner provides proof that the battery was handed over to an authorised operator under Regulation (EU) 2023/1542, and also expands free delivery to collection points and addresses multi-stage type approval vehicles.",ALIGNED,"EUROBAT explicitly advocates for alignment between the ELV Regulation and the Batteries Regulation (EU) 2023/1542, and stresses the importance of environmentally sound end-of-life treatment of vehicle batteries. The amendment directly links free ELV delivery without a battery to proof of handover to an authorised operator as defined under Regulation (EU) 2023/1542, which is precisely the kind of cross-regulatory alignment EUROBAT called for to ensure batteries are properly managed at end-of-life.",1,False
EUROBAT,39573492614-61,2023-11-09,2,0,2,365,Recital 54,recital,CJ45,0.859772,"The amendment replaces the placeholder ""[OP: Batteries Regulation]"" with the specific regulation number ""2023/1542"", thereby formally identifying the Batteries Regulation by its official citation.",NOISE,"The amendment is a purely technical/editorial change that fills in the official citation number for the Batteries Regulation, making no substantive policy change. EUROBAT's position addresses alignment between the ELV Regulation and the Batteries Regulation on substantive matters (chemical restrictions, exemption reviews), but does not advocate for or against this type of citation correction. No directional policy stance from EUROBAT is implicated by this change.",1,False
EUROBAT,39573492614-61,2023-11-09,2,0,2,255,Recital 16,recital,CJ45,0.848863,"The amendment makes no substantive change to the original text — it is identical, representing only a footnote reference to the Batteries Regulation.",NOISE,"The original and amended texts are identical, meaning there is no substantive change to evaluate. EUROBAT's position concerns alignment between the ELV Regulation and the Batteries Regulation, but this is merely a footnote citation with no directional change, so there is no advocacy position that can be matched against it.",1,False
EUROBAT,39573492614-61,2023-11-09,2,0,2,298,Recital 24,recital,CJ45,0.868665,"The amendment adds ""and their components"" after ""batteries"" in recital 24, expanding the design-for-removal requirement to cover not just batteries but also their sub-components.",NOISE,"EUROBAT's position focuses on alignment between the ELV Regulation and the Batteries Regulation regarding chemical/substance restrictions, and on ensuring environmentally sound end-of-life treatment of batteries. They do not express any specific directional stance on whether battery sub-components (as distinct from batteries themselves) should be included in design-for-removal requirements. Their text contains no advocacy position that maps to this specific amendment's direction.",1,False
EUROBAT,39573492614-61,2023-11-09,2,0,2,645,Article 5 – paragraph 2,article,CJ45,0.875936,"The amendment shifts the restriction on lead, mercury, cadmium, and hexavalent chromium from applying to ""vehicle types that are type-approved"" to applying to ""materials and components of vehicles put on the market,"" thereby extending compliance obligations to component and material suppliers rather than solely to vehicle manufacturers.",NOISE,"EUROBAT's position is specifically focused on removing battery substance restrictions entirely from the scope of the ELV/circularity regulation (arguing they are already covered by the Batteries Regulation), not on whether the restriction applies to vehicle types versus materials and components. The amendment's directional change — broadening the scope of who bears compliance obligations — is entirely orthogonal to EUROBAT's advocacy, which concerns the regulatory instrument used rather than the scope of responsible parties within it.",1,False
EUROBAT,39573492614-61,2023-11-09,2,0,2,254,Recital 15 a (new),recital,CJ45,0.867926,"The amendment inserts a new recital calling for a mapping of substances of concern in vehicles and their manufacturing, linking this exercise to REACH evaluation processes and the Chemicals Strategy for Sustainability, as a basis for further restrictions.",OPPOSING,"EUROBAT explicitly advocates for removing battery substance restrictions entirely from the scope of the ELV/vehicle circularity regulation, arguing that the Batteries Regulation already comprehensively addresses this and that duplication should be avoided. The amendment moves in the opposite direction by inserting a new recital that establishes a rationale for further substance restrictions within the vehicle regulation framework, including substances in batteries, thereby expanding rather than removing the regulation's reach over substances of concern in vehicles.",1,False
EUROBAT,39573492614-61,2023-11-09,2,0,2,256,Recital 17,recital,CJ45,0.859244,"The amendment adds a requirement that the Commission consult relevant experts and stakeholders before adopting delegated acts modifying or deleting exemptions, to ensure broader socioeconomic impacts are considered alongside human and environmental health impacts.",NOISE,"EUROBAT's matched text focuses on advocating for the transfer of the lead battery exemption (Annex II exemption 5) directly to the Batteries Regulation rather than being reviewed under the new ELV Regulation, and more broadly argues that battery substance restrictions should be removed from ELV scope entirely. This is a different directional concern from the amendment, which adds a stakeholder/expert consultation requirement before delegated acts are adopted. EUROBAT expresses no specific position on whether such consultation requirements should or should not exist, making their text unrelated to the amendment's direction.",1,False
EUROBAT,39573492614-61,2023-11-09,2,0,2,1749,Annex VII – Part B – point 2 – paragraph 1 – point d a (new),annex,CJ45,0.84058,"The amendment inserts SLI batteries and Electric vehicle batteries (as defined in the Batteries Regulation) into the depollution process, removing them from Part C of Annex VII of the ELV regulation.",ALIGNED,"EUROBAT explicitly advocates that battery-related provisions (restrictions, exemptions, and management of hazardous substances in batteries) should be governed exclusively under the Batteries Regulation rather than the ELV regulation, arguing against duplication and regulatory complexity. The amendment moves SLI and EV batteries out of Part C of Annex VII (the ELV chemical/substance management annex) and into the depollution process, which aligns with EUROBAT's position that battery substance management should not be included in the scope of the ELV regulation and should instead fall under the Batteries Regulation framework.",1,False
Allgemeiner Deutscher Automobil-Club e.V.,02452103934-97,2023-11-13,2,0,2,1454,Article 37 – paragraph 1,article,CJ45,0.854414,"The amendment narrows the seller's obligation to demonstrate non-ELV status to only when requested by the potential buyer, allows a valid roadworthiness certificate as proof, and exempts transfers between private individuals — removing the parallel obligation toward competent authorities that existed in the original.",OPPOSING,"ADAC explicitly argued that the original ""or"" wording (seller demonstrates to buyer OR authorities) was too weak and suggested replacing it with ""and"" to require proof toward both the buyer AND the competent authorities, in order to ensure comprehensive vehicle control. The amendment moves in the opposite direction: it removes the obligation toward authorities entirely and makes even the buyer-facing obligation conditional on a request, which directly contradicts ADAC's stated position for stronger, not weaker, mandatory disclosure requirements.",1,False
Allgemeiner Deutscher Automobil-Club e.V.,02452103934-97,2023-11-13,2,0,2,1457,Article 37 – paragraph 1,article,CJ45,0.843342,"The amendment adds ""holdership or"" before ""ownership"" in the first sentence, extending the obligation to demonstrate a vehicle is not an end-of-life vehicle to transfers of holdership, not just ownership transfers.",UNDETECTABLE,"The ADAC's position focuses on the distinction between the seller's obligations toward buyers versus authorities (suggesting ""and"" instead of ""or""), the burden of proof, and who qualifies as the responsible party — but does not specifically address whether the provision should cover ""holdership"" in addition to ""ownership."" While the justification references the German registration system's distinction between owner and holder (which is a concept ADAC implicitly engages with by referring to ""Letzthalter""), ADAC's text does not clearly advocate for or against extending the scope to holdership transfers, making the directional alignment genuinely ambiguous.",1,False
Allgemeiner Deutscher Automobil-Club e.V.,02452103934-97,2023-11-13,2,0,2,1452,Article 37,article,CJ45,0.846334,"The amendment keeps the original text unchanged but adds a justification arguing that the Annex I criteria for distinguishing used vehicles from end-of-life vehicles go too far and risk classifying repairable vehicles as end-of-life, thereby hindering intra-EU trade and infringing on consumers' property rights — implicitly advocating for removal or narrowing of the Annex I reference.",UNDETECTABLE,"ADAC raises specific concerns about Article 37's burden of proof, the breadth of the ELV classification criteria, and the risk of misclassifying repairable or newer used vehicles — concerns that overlap thematically with the amendment's justification about Annex I going too far. However, ADAC's matched text focuses on procedural questions (who bears the burden of proof, who performs the technical assessment, costs) rather than clearly advocating for removing or narrowing the Annex I criteria as the amendment's justification does; the direction of ADAC's desired change relative to the original text remains genuinely ambiguous.",1,False
Allgemeiner Deutscher Automobil-Club e.V.,02452103934-97,2023-11-13,2,0,2,563,Article 3 – paragraph 1 – point 35 c (new),article,CJ45,0.850633,"The amendment inserts a new definition of 'vehicle of historical interest' (requiring at least 20 years since manufacture/first registration, type no longer in production, and preservation in original state) into the legislative text.",ALIGNED,"ADAC explicitly raises the question of whether Article 37 should apply to vehicles of historical interest (Oldtimer) and advocates for an exemption clause for such vehicles, noting the German definition requires 30 years and original-state preservation. The amendment responds directly to this concern by inserting a formal definition of 'vehicle of historical interest' — a necessary precondition for any such exemption — though it sets the threshold at 20 years rather than the 30 years under German law. The direction of change (introducing a definition to distinguish and potentially protect historical vehicles) clearly aligns with ADAC's expressed advocacy for recognising and carving out such vehicles from the regulation's obligations.",1,False
Allgemeiner Deutscher Automobil-Club e.V.,02452103934-97,2023-11-13,2,0,2,442,Article 2 – paragraph 2 – point d,article,CJ45,0.841538,"The amendment replaces the reference to the definition of ""vehicles of historical interest"" from Directive 2014/45/EU with a new definition within the Regulation itself, and explicitly extends the exemption to cover all parts, components, and spare parts necessary for their maintenance to preserve their historical status.",ALIGNED,"ADAC explicitly advocated for an exemption for vehicles of historical interest (Oldtimer) and their parts from the obligations in Article 37, suggesting language such as ""Diese Vorschrift gilt nicht für Fahrzeuge von historischem Interesse und deren Teile."" The amendment directly responds to this by broadening the exemption to include not only the vehicles themselves but also ""all their parts, components and spare parts necessary for their maintenance activities,"" which closely mirrors ADAC's proposed wording and intent.",1,False
Allgemeiner Deutscher Automobil-Club e.V.,02452103934-97,2023-11-13,2,0,2,444,Article 2 – paragraph 2 – point d a (new),article,CJ45,0.84121,The amendment inserts a new exemption for vehicles of special cultural or historical interest (recognised by competent Member State authorities) from the scope of the relevant article.,ALIGNED,"ADAC explicitly advocated for an exemption for historically significant vehicles (""Oldtimer"") from Article 37's obligations, even suggesting example wording for such an exemption clause. The amendment directly responds to this by inserting exactly such an exemption for vehicles of special cultural or historical interest recognised by Member State authorities.",1,False
International Lead Association,311414214793-82,2023-11-22,1,0,1,645,Article 5 – paragraph 2,article,CJ45,0.878034,"The amendment shifts the restriction on lead, mercury, cadmium, and hexavalent chromium from applying to vehicle types at type-approval to applying to materials and components of vehicles put on the market, thereby extending the obligation to suppliers/component manufacturers rather than solely vehicle manufacturers.",NOISE,"The International Lead Association's position is specifically focused on removing battery substance restrictions entirely from the ELV Regulation and transferring them to the Batteries Regulation — not on whether the restriction applies at the vehicle type-approval level or at the materials/components level. The amendment's directional change (shifting compliance scope from vehicle manufacturers to materials and component suppliers) is entirely orthogonal to the org's advocacy, which concerns the regulatory instrument used (ELV vs. Batteries Regulation), not the supply chain level at which restrictions apply.",1,False
International Lead Association,311414214793-82,2023-11-22,1,0,1,256,Recital 17,recital,CJ45,0.876266,"The amendment adds a requirement that the Commission consult relevant experts and stakeholders before adopting delegated acts modifying or deleting exemptions, to ensure broader socioeconomic impacts are considered alongside human and environmental health impacts.",NOISE,"The ILA's position is specifically focused on removing battery substance restrictions entirely from the ELV Regulation's scope and transferring them to the Batteries Regulation — not on the consultation process or procedural requirements for adopting delegated acts. The amendment's direction (adding a stakeholder consultation requirement before delegated acts) is unrelated to the ILA's directional advocacy, making this a subject mismatch rather than a genuine positional connection.",1,False
International Lead Association,311414214793-82,2023-11-22,1,0,1,643,Article 5 – paragraph 2,article,CJ45,0.860393,"The amendment removes the reference to existing restriction frameworks (Annex XVII of REACH, Annexes I and II of POPs Regulation, and the Batteries Regulation) and shifts the heavy metal ban obligation from vehicle manufacturers alone to also cover materials and components put on the market, restoring supply chain accountability.",UNDETECTABLE,"The ILA's position focuses on the interaction between the ELV Regulation and the Batteries Regulation — specifically arguing that batteries are already comprehensively regulated under the Batteries Regulation and should not be doubly restricted under the ELV framework. The amendment's key change is about restoring shared supply chain responsibility (materials and components) rather than about the relationship with the Batteries Regulation. While there is a genuine topical connection (heavy metal restrictions in vehicles and the role of the Batteries Regulation), it is genuinely unclear whether the amendment's direction — removing the cross-reference to the Batteries Regulation while extending obligations to material/component suppliers — satisfies, contradicts, or is orthogonal to ILA's specific concern about double regulation of batteries.",1,False
International Lead Association,311414214793-82,2023-11-22,1,0,1,669,Article 5 – paragraph 8,article,CJ45,0.858065,"The amendment removes the word ""human"" from ""human health,"" broadening the health consideration to health generally (potentially including animal health) rather than specifically human health.",NOISE,"The organisation's text does not express any directional stance on whether health considerations in the delegated act criteria should be limited to ""human health"" or broadened to ""health"" generally. Their position focuses on the overlap between the ELV Regulation and the Batteries Regulation regarding substance restrictions, not on the scope of health terminology in the delegated act criteria. An organisation with the opposite view on this specific wording change could produce identical advocacy text.",1,False
International Lead Association,311414214793-82,2023-11-22,1,0,1,648,Article 5 – paragraph 2,article,CJ45,0.85643,"The amendment removes the cross-references to Annex XVII of REACH, Annexes I and II of the POPs Regulation, and the Batteries Regulation from the restriction on lead, mercury, cadmium, and hexavalent chromium in new vehicle types, leaving the prohibition as a standalone rule without those regulatory linkages.",UNDETECTABLE,"The ILA's position specifically argues that the Batteries Regulation (EU) 2023/1542 already comprehensively regulates battery substances and should not be duplicated by the ELV Regulation — which is directly relevant to the removal of the cross-reference to the Batteries Regulation in the amendment. However, the amendment also removes the cross-references to REACH and the POPs Regulation, and it is genuinely unclear whether the ILA would support this broader delinking or only the removal of the Batteries Regulation reference specifically. The direction of the amendment partially aligns with the ILA's concern but the full scope of the change makes the overall alignment ambiguous.",1,False
International Lead Association,311414214793-82,2023-11-22,1,0,1,298,Recital 24,recital,CJ45,0.876637,"The amendment adds ""and their components"" after ""batteries"" in the recital, expanding the design-for-removal requirement to cover not just batteries but also their components.",NOISE,"The organisation's position is focused entirely on removing chemical/hazardous substance restrictions on battery substances from the ELV Regulation's scope (Article 5), arguing that the Batteries Regulation already covers this. The amendment concerns expanding design-for-removal requirements to include battery components — a completely different subject on which the organisation expresses no directional stance.",1,False
International Lead Association,311414214793-82,2023-11-22,1,0,1,295,Recital 24,recital,CJ45,0.875454,"The amendment adds explicit mention of ""battery packs"" alongside batteries and e-drive motors for removal/recycling design requirements, and introduces a new sentence encouraging the Commission to develop standards for design and assembly techniques that facilitate maintenance, repair, and repurposing of batteries and battery packs.",NOISE,"The organisation's position is focused exclusively on advocating for the removal of chemical/hazardous substance restrictions on battery substances from the ELV Regulation's scope (Article 5), arguing these should be governed solely by the Batteries Regulation. The amendment, by contrast, concerns design requirements for the removability of battery packs and encourages standards for battery maintenance, repair, and repurposing — a completely different subject. The org text contains no directional stance on design requirements or removability standards for batteries or battery packs.",1,False
International Lead Association,311414214793-82,2023-11-22,1,0,1,297,Recital 24,recital,CJ45,0.871339,The amendment adds requirements concerning access to technical and digital information (alongside existing design requirements) for new vehicle types to ensure batteries and e-drive motors can be removed and recycled.,NOISE,"The organisation's position is entirely focused on the removal of chemical/hazardous substance restrictions (specifically lead, cadmium, mercury, and hexavalent chromium) from the ELV Regulation's scope, arguing these should be governed solely by the Batteries Regulation. The amendment concerns adding information access requirements for batteries and e-drive motors — a completely unrelated subject to the org's advocacy.",1,False
International Lead Association,311414214793-82,2023-11-22,1,0,1,365,Recital 54,recital,CJ45,0.869859,"The amendment replaces the placeholder ""[OP: Batteries Regulation]"" with the actual citation ""2023/1542"", formally identifying the Batteries Regulation by its official number.",NOISE,"The amendment is a purely technical/editorial change that fills in the official regulation number (2023/1542) in place of a placeholder, making no substantive policy change. The organisation's position concerns whether battery substance restrictions should be removed from the ELV Regulation's scope entirely — a substantive policy direction that is unrelated to this clerical citation fix.",1,False
International Lead Association,311414214793-82,2023-11-22,1,0,1,372,Recital 57,recital,CJ45,0.866718,"The amendment adds a condition to the exclusion of electric vehicle batteries from essential parts, requiring the last owner to provide documentation proving the battery was handled by a professional operator in accordance with the Batteries Regulation.",NOISE,"The organisation's position is focused entirely on the chemical restrictions (lead, cadmium, mercury, hexavalent chromium) in Article 5 and the scope of the ELV Regulation relative to the Batteries Regulation — not on the conditions under which EV batteries may be excluded from essential parts for end-of-life vehicle handover. The amendment's subject matter (documentation requirements for battery second-life exclusions) is unrelated to the org's specific advocacy, making this a case of unrelated subjects.",1,False
International Lead Association,311414214793-82,2023-11-22,1,0,1,257,Recital 17 a (new),recital,CJ45,0.845684,The amendment inserts a new recital affirming that the Commission should have delegated powers to amend restrictions on substances in vehicles (including in end-of-life vehicles) to address unacceptable risks to human health or the environment.,OPPOSING,"The ILA explicitly requests that restrictions on battery substances be removed entirely from the scope of the ELV Regulation, arguing that the Batteries Regulation already adequately covers such risks. This new recital moves in the opposite direction by affirming and reinforcing the Commission's delegated authority to impose substance restrictions under the ELV framework, directly contradicting the ILA's position that such regulation should be consolidated solely under the Batteries Regulation.",1,False
