organisation,transparency_reg_id,source_date,meetings_total,meetings_commission,meetings_ep,amendment_number,target_element,target_type,committee,similarity_score,provision_effect,label,reasoning,n_chunks,conflict
Cefic,64879142323-90,2023-12-04,1,0,1,1594,Article 55 – paragraph 2 – point e b (new),article,CJ45,0.850197,"The amendment inserts a new provision enabling the possibility to set targets for bio-based feedstock use in vehicle plastics and sustainability requirements for such feedstock, where no such provision existed before.",ALIGNED,"Cefic explicitly calls for the proposal to ""consider the use of bio-based and CO2-based feedstocks to be used in materials, plastics and chemicals for vehicles"" and advocates for ""biomass- and CO2-based content as complementary to recycled content,"" directly supporting the introduction of bio-based feedstock provisions. The amendment responds precisely to this advocacy by inserting the possibility to lay down targets and sustainability requirements for bio-based feedstock in vehicle plastics.",1,False
Cefic,64879142323-90,2023-12-04,1,0,1,705,Article 6 – paragraph 1 – subparagraph 1 a (new),article,CJ45,0.841521,The amendment inserts a new requirement that biomass used to produce plastics must meet EU sustainability criteria (excluding GHG emissions) and that biobased plastics must achieve at least 1 kg CO2/kg lower cradle-to-grave GHG emissions compared to their fossil counterparts.,UNDETECTABLE,"Cefic specifically advocates for recognising biobased feedstocks as contributing to circular economy goals in vehicles, calling for biomass-based content to be considered complementary to recycled content. However, the amendment introduces specific sustainability criteria and a GHG emission threshold for biobased plastics, and it is genuinely unclear whether Cefic's position supports or opposes these particular conditions — they advocate for inclusion of biobased feedstocks but do not express a directional stance on the stringency or nature of sustainability criteria that should govern them.",1,False
Cefic,64879142323-90,2023-12-04,1,0,1,706,Article 6 – paragraph 1 – subparagraph 1 b (new),article,CJ45,0.840809,"The amendment inserts a new provision requiring the Commission to assess the need for derogations from the biobased plastic feedstock target and empowers it to adopt delegated acts granting such derogations from the scope, timing, or level of that target.",ALIGNED,"Cefic explicitly advocates for considering bio-based feedstocks as complementary to recycled content in vehicles, calling for an inclusive approach that factors in biomass-based content. The amendment directly responds to this by creating a mechanism for derogations from the biobased plastic feedstock target, providing the flexibility Cefic sought for bio-based feedstock integration into the regulatory framework.",1,False
Cefic,64879142323-90,2023-12-04,1,0,1,485,Article 3 – paragraph 1 – point 9,article,CJ45,0.871001,"The amendment replaces the REACH-based definition of ""plastic"" with one based on Regulation (EU) No 10/2011, adding the qualifier that the polymer must be capable of serving as the main structural component of final materials and articles, and explicitly including bio-based plastic.",ALIGNED,"Cefic explicitly urged replacing the REACH-based definition with the more precise definition from Regulation (EU) No 10/2011, characterising plastics as polymers ""capable of functioning as a main structural component of final materials and articles"" — exactly the language and regulatory reference the amendment adopts. The amendment directly responds to Cefic's specific and directional advocacy.",1,False
Cefic,64879142323-90,2023-12-04,1,0,1,477,Article 3 – paragraph 1 – point 9,article,CJ45,0.866695,"The amendment expands the definition of 'plastic' by adding a reference to Regulation (EU) No 10/2011 (Article 3, points (2) and (3)) alongside the existing REACH reference, and adds the qualifier ""capable of functioning as a main structural component of final materials and articles, including biomass-derived plastic.""",ALIGNED,"Cefic explicitly urged replacing the broad REACH-only definition with the more precise definition from Regulation (EU) No 10/2011, which characterises plastics as ""capable of functioning as a main structural component of final materials and articles"" — exactly the language the amendment incorporates. The amendment directly responds to Cefic's specific advocacy for a narrower, more targeted definition of plastics.",1,False
Cefic,64879142323-90,2023-12-04,1,0,1,487,Article 3 – paragraph 1 – point 9,article,CJ45,0.865771,"The amendment changes the reference for the definition of 'plastic' from Article 3, point (5) of Regulation (EC) No 1907/2006 (REACH) to Article 3, point (2) of Regulation (EU) No 10/2011 (Food Contact Materials), thereby narrowing the definition to exclude substances like polymeric surfactants.",ALIGNED,Cefic explicitly argued that the original definition based on REACH was too broad (encompassing polymeric surfactants and other irrelevant substances) and specifically urged the use of the more precise definition from Regulation (EU) No 10/2011 — exactly the change the amendment makes. The amendment directly responds to Cefic's stated position.,1,False
Cefic,64879142323-90,2023-12-04,1,0,1,486,Article 3 – paragraph 1 – point 9,article,CJ45,0.863869,"The amendment changes the definition of 'plastic' from referencing Article 3(5) of REACH Regulation (EC) No 1907/2006 to referencing Articles 3(2) and (3) of Regulation (EU) No 10/2011, and explicitly includes biobased plastic within the definition.",ALIGNED,"Cefic explicitly urged replacing the REACH-based definition with the one from Regulation (EU) No 10/2011, arguing it provides a more precise and targeted scope for plastics — exactly the change the amendment makes. The amendment directly responds to Cefic's specific advocacy, adopting the very regulation they recommended as the definitional basis.",1,False
Cefic,64879142323-90,2023-12-04,1,0,1,483,Article 3 – paragraph 1 – point 9,article,CJ45,0.861704,"The amendment replaces the definition of 'plastic' from referencing Article 3(5) of Regulation (EC) No 1907/2006 to referencing Article 3(2) and (3) of Regulation (EU) No 10/2011, and adds the qualifier ""capable of functioning as a main structural component of final materials and articles"".",ALIGNED,"Cefic explicitly argued that the original definition based on Regulation (EC) No 1907/2006 was too broad (encompassing polymeric surfactants irrelevant to the context) and specifically urged the use of the definition from Regulation (EU) No 10/2011, including the exact phrase ""capable of functioning as a main structural component of final materials and articles."" The amendment adopts precisely this change, directly responding to Cefic's stated position.",1,False
Cefic,64879142323-90,2023-12-04,1,0,1,616,Article 4 – paragraph 2 – point a,article,CJ45,0.842051,"The amendment adds ""where possible"" to qualify the obligation to collect data through the full chain of supply, making it a best-effort rather than absolute requirement.",ALIGNED,"Cefic's position highlights that the current approach in Annex IV is ""fragmented and linear"" and that manufacturers bear the burden of gathering data from upstream suppliers, calling instead for dedicated collaboration with suppliers rather than a top-down mandatory data collection obligation. By inserting ""where possible,"" the amendment softens the absolute requirement to collect data through the full supply chain, which aligns with Cefic's concern that the existing obligation is overly burdensome and impractical without proper supplier collaboration frameworks in place.",1,False
Cefic,64879142323-90,2023-12-04,1,0,1,872,Article 9 – paragraph 2,article,CJ45,0.842898,"The amendment adds a sentence to the circularity strategy requirement specifying that it must not entail disproportionate burdens and must account for the capacities and information actually available from suppliers, especially SMEs.",UNDETECTABLE,"Cefic's position focuses on technology neutrality, safety/performance considerations, and alignment with ESRS reporting requirements in the circularity strategy — not specifically on supplier burden or SME capacity constraints. While Cefic does advocate for a materiality-based, phased approach to reduce disproportionate reporting obligations (which has some thematic overlap with avoiding disproportionate burdens), their matched chunk does not directly advocate for the specific direction the amendment takes (protecting SME suppliers from disproportionate burdens). The connection is real but the directional alignment is genuinely ambiguous.",1,False
European Copper Institute,04134171823-87,2023-12-04,1,0,1,780,Article 6 – paragraph 3 – subparagraph 3,article,CJ45,0.857066,"The amendment changes the Commission's discretionary power to adopt an implementing act on steel recycling methodology into a mandatory obligation with a deadline, expands scope to include steel ""recovered"" from post-consumer waste and end-of-life vehicles, and adds anti-circumvention/fraud requirements and third-party certification provisions.",NOISE,"The ECI's position focuses on copper recycling, resource efficiency, unknown whereabouts of exported vehicles, and hazardous substances — not on steel recycling methodology or the mandatory vs. discretionary nature of the Commission's implementing act. The organisation's text contains no substantive advocacy position on the specific subject matter of this amendment.",1,False
European Copper Institute,04134171823-87,2023-12-04,1,0,1,389,Recital 64,recital,CJ45,0.863007,"The amendment changes the prohibition on shredding ELVs together with packaging waste and WEEE into a conditional permission, allowing such combined shredding only if certain criteria and limit values are met, rather than banning it outright.",UNDETECTABLE,"The European Copper Institute advocates for maximising high-quality copper recovery from ELVs and supports ambitious measures for separation and dismantling before shredding, but does not take a specific directional stance on whether combined shredding should be outright prohibited or conditionally permitted. Their position is consistent with both the original ban and the amended conditional allowance, as both aim to improve copper-steel separation — making it genuinely unclear whether the conditional approach satisfies or contradicts their advocacy.",1,False
European Copper Institute,04134171823-87,2023-12-04,1,0,1,245,Recital 12 a (new),recital,CJ45,0.849171,"The amendment inserts a new recital recognising ELVs as valuable resources with economic potential, endorsing reuse where sensible, and highlighting that illegal exports cause both environmental risks and economic losses for the EU.",ALIGNED,The European Copper Institute explicitly advocates for keeping economic value from ELVs within the EU economy and highlights that illegal exports lead to over €6bn in losses — precisely the framing the amendment introduces. The new recital's recognition of ELVs as economically valuable resources and its identification of illegal exports as causing economic losses for the EU directly mirrors the specific directional stance ECI expressed in its position paper.,1,False
European Copper Institute,04134171823-87,2023-12-04,1,0,1,390,Recital 64,recital,CJ45,0.859821,"The amendment changes the recital's stated purpose from improving ""the separation of copper from steel fractions"" to improving ""the separation of copper, steel, aluminium and glass fractions,"" broadening the list of materials whose separation is to be improved.",NOISE,"The organisation's position is focused specifically on maximising copper recovery from ELVs and supports the shredding separation measures as they relate to copper. The amendment's change — adding aluminium and glass alongside copper and steel as materials whose separation should be improved — is a broadening of scope that neither advances nor contradicts the org's copper-specific advocacy. The org text does not express any directional stance on whether aluminium or glass should be included or excluded from this provision, so the amendment's direction cannot be meaningfully mapped onto the org's position.",1,False
European Copper Institute,04134171823-87,2023-12-04,1,0,1,393,Recital 66 a (new),recital,CJ45,0.862388,"The amendment inserts a new recital recognising the critical role of retaining high-quality scrap metals within the EU for circular economy, industrial competitiveness, and defence, and calls on the Commission to consider measures to enhance retention and recycling of high-quality metal scrap rather than allowing its export to non-EU countries.",ALIGNED,"The European Copper Institute explicitly advocates for maximising the recovery and retention of high-quality secondary copper from end-of-life vehicles within the EU, emphasising that the waste legislation should secure the basis for recovery of high-quality copper and avoid copper losses from the EoL stream. The amendment directly responds to this by inserting a recital that recognises the importance of retaining high-quality scrap metals within the EU and calls for Commission measures to enhance that retention and recycling — moving in precisely the direction ECI advocated.",1,False
European Copper Institute,04134171823-87,2023-12-04,1,0,1,353,Recital 48,recital,CJ45,0.875155,"The amendment adds language calling for a clear Union-wide framework to address ""missing vehicles"" and strengthens the call for national measures alongside Member State cooperation, rather than relying solely on Member State cooperation.",ALIGNED,"ECI explicitly criticises the Commission proposal for keeping competence at national level and advocates for EU-level rules to address missing/illegally exported vehicles, including strengthening national registration systems and enforcement. The amendment directly responds to this by inserting a call for a ""clear Union-wide framework"" to deal with missing vehicles, moving the text in the direction ECI advocated — from a purely Member State cooperation approach toward a Union-level framework combined with strengthened national measures.",1,False
European Copper Institute,04134171823-87,2023-12-04,1,0,1,1468,Article 38 – paragraph 3 – introductory part,article,CJ45,0.857953,"The amendment replaces a permissive export framework (used vehicles ""may be exported only if"" certain conditions are met) with a presumption against export restrictions unless a vehicle has been classified as an ELV, and explicitly states that lack of roadworthiness certification alone is not sufficient grounds for ELV classification.",OPPOSING,"ECI explicitly advocates for stronger controls on used vehicle exports to prevent ELV material leakage to third countries, recommending stricter registration, enforcement, and documentation requirements. The amendment moves in the opposite direction by removing export restrictions as the default and weakening the link between lack of roadworthiness and ELV classification, which ECI would view as undermining efforts to curb illegal exports and unknown whereabouts of ELVs.",1,False
European Copper Institute,04134171823-87,2023-12-04,1,0,1,1505,Article 39 – paragraph 2,article,CJ45,0.847861,"The amendment replaces ""economic operator"" with ""natural or legal person"" as the entity to be informed when customs authorities refuse to release a vehicle for export due to information discrepancies.",NOISE,"The organisation's position focuses on strengthening national registration systems, controlling illegal ELV exports, and improving statistics — not on the specific terminology used to describe who is notified by customs authorities. The change from ""economic operator"" to ""natural or legal person"" is a definitional/scope clarification that the organisation's text does not address in any directional way.",1,False
European Copper Institute,04134171823-87,2023-12-04,1,0,1,1504,Article 39 – paragraph 1,article,CJ45,0.84714,"The amendment removes the word ""considered"" so that the vehicle must actually be roadworthy (not merely ""considered roadworthy"") under Article 38(3)(b) before customs releases it for export.",UNDETECTABLE,"The European Copper Institute advocates for stronger controls on used vehicle exports to reduce illegal ELV exports and material leakage, and specifically recommends amending Article 38 to include a statement confirming vehicles fulfil the requirements of paragraph 3. However, their position focuses on broader systemic issues (registration systems, certificates of destruction, enforcement) rather than the specific linguistic distinction between a vehicle being ""considered roadworthy"" versus ""roadworthy."" It is genuinely unclear whether removing the word ""considered"" — a subtle drafting clarification — satisfies, contradicts, or is simply orthogonal to their specific advocacy direction.",1,False
European Copper Institute,04134171823-87,2023-12-04,1,0,1,410,Recital 77,recital,CJ45,0.847046,"The amendment adds explicit objectives to the cooperation mechanisms — specifically facilitating prevention and detection of illegal treatment and export of end-of-life vehicles, and permanently addressing the issue of ""missing vehicles"" — to what was originally a general cooperation mechanism for inspections and vehicle registration data exchange.",ALIGNED,"The European Copper Institute explicitly advocates for stronger measures to combat illegal ELV exports, dismantling at illegal sites, and the problem of ""unknown whereabouts"" (i.e., missing vehicles), recommending strengthened enforcement and cooperation among national authorities. The amendment directly responds to this by adding the prevention and detection of illegal treatment/export and permanently addressing ""missing vehicles"" as explicit objectives of the cooperation mechanisms, aligning precisely with ECI's stated directional advocacy.",1,False
European Copper Institute,04134171823-87,2023-12-04,1,0,1,505,Article 3 – paragraph 1 – point 14 a (new),article,CJ45,0.873202,"The amendment inserts a new definition of 'end-of-life-vehicle collection and treatment centre', specifying it as a facility authorised to receive ELVs before other treatment facilities and to carry out at minimum purification, depollution, and removal of parts/components where technically feasible and economically viable.",NOISE,"The organisation's text focuses on controlling ELV exports, strengthening vehicle registration systems, certificates of destruction, and hazardous substances/recycling concerns — not on the definition or scope of authorised collection and treatment centres. The matched chunk contains no specific directional advocacy position regarding how such facilities should be defined or what minimum activities they must perform.",1,False
European Copper Institute,04134171823-87,2023-12-04,1,0,1,401,Recital 68,recital,CJ45,0.870922,"The amendment adds language to the original text specifying that the burden of proof should not fall disproportionately on vehicle owners, that additional documentation should only be required if competent authorities present clear and substantial evidence that a vehicle meets ELV criteria, and that used vehicles should be presumed fit for resale or export absent such evidence.",OPPOSING,"The European Copper Institute's position advocates for strengthening controls over used vehicle exports and ELV identification — including stronger registration systems, stricter documentation requirements, and better enforcement — to prevent illegal exports and treatment at illegal sites. The amendment moves in the opposite direction by reducing the burden of proof on vehicle owners and creating a presumption that used vehicles are fit for resale or export, which would weaken the very controls ECI is calling for.",1,False
European Copper Institute,04134171823-87,2023-12-04,1,0,1,400,Recital 68,recital,CJ45,0.864142,"The amendment clarifies that a vehicle owner must provide specific documentation (a valid roadworthiness certificate or a competent authority-verified Annex I assessment) to prove a used vehicle is not an end-of-life vehicle, replacing the vaguer obligation to ""demonstrate"" this status.",ALIGNED,"ECI specifically recommended that documentation requirements for used vehicle transfers include ""necessary documentation"" upon change of ownership and proposed amending the relevant paragraph to include ""a statement confirming that the used vehicle fulfils the requirements set out in paragraph 3,"" advocating for clearer, more specific documentation obligations. The amendment moves in exactly this direction by specifying that a valid roadworthiness certificate (or equivalent verified assessment) must be provided as documentation, which aligns with ECI's push for stronger, more concrete documentation requirements to distinguish used vehicles from ELVs and combat illegal exports.",1,False
European Copper Institute,04134171823-87,2023-12-04,1,0,1,363,Recital 53,recital,CJ45,0.859348,"The amendment replaces the vague ""as soon as possible"" timeframe for depollution operations with a specific 15-day deadline after delivery to the authorised treatment facility.",NOISE,"The organisation's text does not express any position on the timeframe for depollution operations at authorised treatment facilities. The matched chunk discusses hazardous substances in ELVs and vehicle registration/export controls, neither of which relates to the specific change made by this amendment (introducing a 15-day depollution deadline). There is no substantive directional stance from the organisation on this topic.",1,False
European Copper Institute,04134171823-87,2023-12-04,1,0,1,670,Article 5 – paragraph 8 a (new),article,CJ45,0.847792,"The amendment inserts a new requirement for the Commission, assisted by ECHA, to prepare a report on substances of concern in vehicles within 24 months and consider follow-up measures including delegated acts.",ALIGNED,"ECI explicitly advocates for a lifecycle/materials approach to substances of concern, exemptions where exposure does not cause harm, and expresses willingness to contribute to the development of Delegated Acts on substances of concern in vehicles. The amendment's insertion of a Commission report with ECHA assistance that considers appropriate follow-up measures including delegated acts directly responds to ECI's call for a careful, evidence-based assessment of substances of concern using a lifecycle approach before imposing requirements — aligning with their position that identity and form of substances matter and that recycling should not be hindered by blanket restrictions.",1,False
European Copper Institute,04134171823-87,2023-12-04,1,0,1,292,Recital 22,recital,CJ45,0.86004,The amendment adds copper (along with nickel and cobalt) to the list of materials for which the Commission may establish minimum recycled content shares from post-consumer waste in vehicles.,ALIGNED,"The European Copper Institute explicitly advocates for facilitating copper's recovery and recycling from ELVs and expresses willingness to contribute to the Delegated Acts on recycling targets, directly supporting copper's inclusion in the recycled content framework. The amendment responds precisely to this by adding copper to the list of materials subject to minimum recycled content requirements.",1,False
European Copper Institute,04134171823-87,2023-12-04,1,0,1,256,Recital 17,recital,CJ45,0.85877,"The amendment adds a requirement that, before adopting a delegated act modifying or deleting exemptions, the Commission must consult relevant experts and stakeholders to ensure broader socioeconomic impacts are taken into account, in addition to human and environmental health impacts.",ALIGNED,"ECI explicitly states its willingness to ""further contribute to the policymaking process"" and remains ""at the Commission's disposal for any information our expertise can provide in developing the Delegated Acts,"" and advocates for a lifecycle/socioeconomic approach when assessing exemptions. The amendment directly responds to this by mandating consultation of relevant experts and stakeholders and requiring broader socioeconomic impacts to be considered before delegated acts are adopted — precisely the direction ECI advocated for.",1,False
Eurometaux,61650796093-48,2023-12-04,3,0,3,802,Article 6 – paragraph 4 – subparagraph 2,article,CJ45,0.864949,"The amendment expands the list of materials subject to minimum recycled content requirements by adding glass, rubber, nickel, and cobalt to the existing list (aluminium, magnesium, rare earth elements, boron), and adds a date reference for when these requirements apply.",ALIGNED,Eurometaux explicitly advocates for minimum recycled content requirements and highlights nickel and cobalt as key metals present in car batteries that should be subject to recovery and recycling measures. The amendment's addition of nickel and cobalt to the list of materials with mandatory minimum recycled content directly responds to the organisation's position that these metals should be covered under the regulation's circularity objectives.,1,False
