organisation,transparency_reg_id,source_date,meetings_total,meetings_commission,meetings_ep,amendment_number,target_element,target_type,committee,similarity_score,provision_effect,label,reasoning,n_chunks,conflict
Volkswagen Aktiengesellschaft,6504541970-40,2023-12-04,8,0,8,865,Article 8 – paragraph 5,article,CJ45,0.856673,"The amendment extends the type-approval declaration submission procedure to also cover vehicles approved under Regulation (EU) 168/2013 (L-category vehicles), in addition to those under Regulation (EU) 2018/858.",UNDETECTABLE,"Volkswagen's position calls for clearer clarification, tools, and processes for new type-approval requirements and alignment with globally harmonised standards, which is related to the type-approval framework. However, the amendment specifically extends the procedural scope to include L-category vehicles under Regulation (EU) 168/2013, and VW's text does not address this specific extension or express a directional stance on whether L-category vehicles should or should not be included, making it genuinely unclear whether this amendment satisfies, contradicts, or ignores their position.",1,False
Volkswagen Aktiengesellschaft,6504541970-40,2023-12-04,8,0,8,852,Article 8 – paragraph 1,article,CJ45,0.855896,"The amendment changes the type-approval obligation from applying to individual new vehicles to applying to new vehicle types, and sets a specific applicability date of 72 months after entry into force of the Regulation.",ALIGNED,"VW explicitly states that ""Manufacturers and type approval authorities will need more time and resources to set up processes,"" advocating for more time before the new type approval requirements apply. The amendment introduces a 72-month transition period before the type-approval requirements take effect, directly responding to VW's call for additional time. VW's position is specific enough (more time needed for type approval processes) to align with the amendment's direction of extending the implementation timeline.",1,False
Volkswagen Aktiengesellschaft,6504541970-40,2023-12-04,8,0,8,853,Article 8 – paragraph 1,article,CJ45,0.85545,"The amendment changes ""new vehicles"" to ""new vehicle types"" and adds a 72-month transition period before the type-approval requirements apply, while also adding Regulation (EU) 168/2013 as a reference.",ALIGNED,"VW explicitly states that manufacturers and type approval authorities ""will need more time and resources to set up processes"" and that the 12-month timeline in the original Article 8 is insufficient, advocating for a longer transition period. The amendment introduces a 72-month timeline (aligned with Article 7's timeline, which VW also references), directly responding to VW's call for more time and for alignment of timelines across requirements.",1,False
Volkswagen Aktiengesellschaft,6504541970-40,2023-12-04,8,0,8,856,Article 8 – paragraph 1,article,CJ45,0.853679,"The amendment changes the type-approval obligation from applying to individual new vehicles to applying to vehicle types, and sets a specific timeline of 72 months after entry into force for compliance.",ALIGNED,"Volkswagen explicitly states that ""Manufacturers and type approval authorities will need more time and resources to set up processes"" and advocates for more time for the new type approval requirements to be implemented. The amendment introduces a 72-month transition period before the type-approval obligations apply, directly responding to VW's position that more time is needed. VW's position is specific enough (requesting more time for type approval processes) to be directionally aligned with the amendment's introduction of a 72-month delay.",1,False
Volkswagen Aktiengesellschaft,6504541970-40,2023-12-04,8,0,8,854,Article 8 – paragraph 1,article,CJ45,0.853679,"The amendment changes the type-approval obligation from applying to individual new vehicles to applying to vehicle types, and adds a specific timeline of 72 months after entry into force for compliance.",ALIGNED,"VW explicitly states that ""the timeline of requirements for components listed in Part C of Annex VII must be aligned"" and notes that manufacturers and type approval authorities ""will need more time and resources to set up processes,"" implying the 12-month timeline in the original is insufficient. The amendment introduces a 72-month timeline (consistent with Art. 7), which directly responds to VW's advocacy for more time and alignment of timelines across requirements.",1,False
Volkswagen Aktiengesellschaft,6504541970-40,2023-12-04,8,0,8,301,Recital 26,recital,CJ45,0.874518,"The amendment adds a requirement for the Commission to adopt implementing acts providing manufacturers with commonly agreed standards for conducting life cycle assessments as part of their circularity strategies, while also removing the explicit limitation of the circularity strategy obligation to ""manufacturers of passenger cars and light commercial vehicles.""",ALIGNED,"Volkswagen explicitly called for ""clarification on the format or method for the strategy and process and expectations of enforcement and type approval authorities"" and warned against lack of harmonisation across EU Member States. The amendment directly responds to this by requiring the Commission to adopt implementing acts providing ""commonly agreed standards"" for conducting life cycle assessments as part of circularity strategies, which addresses VW's specific concern about missing formats, unclear expectations, and unharmonised processes.",1,False
Volkswagen Aktiengesellschaft,6504541970-40,2023-12-04,8,0,8,310,Recital 28,recital,CJ45,0.887644,"The amendment adds ""retrofit operators"" as a new category of operators entitled to receive information from manufacturers, and suggests that existing industry tools (e.g., IDIS) could be used to provide this information.",UNDETECTABLE,"VW's position focuses on limiting the scope of information obligations (e.g., restricting free-of-charge information to waste management operators only via IDIS, and opposing obligations toward repair and maintenance operators). The amendment adds ""retrofit operators"" as a new recipient category and references existing tools like IDIS. VW's advocacy for using IDIS aligns with the tool reference, but their broader position opposes expanding the circle of obligated recipients — yet the amendment's primary change (adding retrofit operators) is neither explicitly supported nor opposed by VW's text, making the directional relationship genuinely ambiguous.",1,False
Volkswagen Aktiengesellschaft,6504541970-40,2023-12-04,8,0,8,309,Recital 28,recital,CJ45,0.885984,"The amendment expands the list of operators entitled to receive manufacturer information (adding dismantlers, retrofitters, remanufacturers) and removes the ""excluding administrative costs"" qualifier from the free-of-charge provision, while also extending battery information to constituent elements.",OPPOSING,"VW explicitly advocated for narrowing the information obligation — limiting free-of-charge access to waste management operators only (via IDIS) and removing the free-of-charge requirement for repair and maintenance operators. The amendment moves in the opposite direction by expanding the circle of entitled operators (adding dismantlers, retrofitters, remanufacturers) and removing even the ""excluding administrative costs"" qualifier, making the free-of-charge provision broader, not narrower.",1,False
Volkswagen Aktiengesellschaft,6504541970-40,2023-12-04,8,0,8,1332,Article 28 – paragraph 3,article,CJ45,0.8488,"The amendment adds a requirement that waste management operators conducting shredding must also comply with the criteria and limit values of Part G of Annex VII, in addition to the existing prohibition on mixing ELV waste with packaging and WEEE waste.",ALIGNED,"Volkswagen explicitly argues that waste management operators (recyclers) should be targeted to improve and implement recycling technologies, since the expertise and responsibilities lie with them and not the vehicle producer. The amendment imposes additional compliance obligations (criteria and limit values of Part G of Annex VII) directly on waste management operators conducting shredding, which aligns with VW's advocacy for placing regulatory burdens on recyclers rather than OEMs.",1,False
Volkswagen Aktiengesellschaft,6504541970-40,2023-12-04,8,0,8,391,Recital 65,recital,CJ45,0.848479,"The amendment adds a reference to the waste hierarchy established by Article 4 of Directive 2008/98/EC as an additional justification for the landfill ban on non-inert waste fractions from shredded end-of-life vehicles, without changing the substantive obligation.",NOISE,"The amendment only adds a reference to the waste hierarchy directive as a recital justification, without altering the substantive landfill ban. Volkswagen's matched text focuses on the circularity strategy requirements under Article 9 and Annex IV, expressing no directional position on the landfill ban for post-shredder waste fractions or the addition of a waste hierarchy reference to the recital.",1,False
Volkswagen Aktiengesellschaft,6504541970-40,2023-12-04,8,0,8,305,Recital 28,recital,CJ45,0.88859,"The amendment expands the list of stakeholders entitled to information access (adding dismantlers and remanufacturers explicitly) and narrows the scope of information to be provided by referencing paragraph 66 of the Commission's Supplementary guidelines on vertical restraints, rather than broadly requiring all information enabling safe removal and replacement.",UNDETECTABLE,"VW's position advocates for limiting the information obligation — specifically restricting it to removal information (not replacement) provided free of charge only to waste management operators via IDIS, and removing the free-of-charge obligation for repair and maintenance operators. The amendment partially moves in this direction by anchoring the scope of information to paragraph 66 of the Commission's Supplementary guidelines (which could narrow the obligation), but it also expands the list of entitled recipients (adding dismantlers and remanufacturers). It is genuinely unclear whether the net effect of the amendment satisfies or contradicts VW's specific concerns about scope limitation and the free-of-charge requirement.",1,False
Volkswagen Aktiengesellschaft,6504541970-40,2023-12-04,8,0,8,311,Recital 28,recital,CJ45,0.885751,"The amendment adds requirements for manufacturers to provide information on the digital coding of parts and on how to access and remove e-drive motors, expanding the scope of mandatory information disclosure beyond what was in the original text.",OPPOSING,"VW explicitly advocates for narrowing the information obligations — limiting manufacturers to providing only removal information to waste management operators via IDIS and opposing broad free-of-charge information requirements. The amendment moves in the opposite direction by expanding the scope of mandatory information disclosure to include digital coding of parts and access/removal instructions for e-drive motors, which contradicts VW's position that such obligations should be reduced rather than extended.",1,False
Volkswagen Aktiengesellschaft,6504541970-40,2023-12-04,8,0,8,308,Recital 28,recital,CJ45,0.88481,"The amendment strengthens manufacturer obligations by adding ""immediate, free"" access, expanding scope to include ""non-destructive removal,"" repair, remanufacturing, and refurbishment, and explicitly including battery packs alongside batteries.",OPPOSING,"VW explicitly advocates for removing ""free of charge"" from information provision to repair and maintenance operators and limiting manufacturer obligations to providing only removal information to waste management operators via IDIS. The amendment moves in the opposite direction by adding ""immediate, free"" access and expanding the scope of information to cover repair, remanufacturing, and refurbishment — directly contradicting VW's stated positions.",1,False
Volkswagen Aktiengesellschaft,6504541970-40,2023-12-04,8,0,8,324,Recital 31 a (new),recital,CJ45,0.857105,"The amendment inserts a new recital requiring the Commission, when designing the vehicle passport, to base information sources on existing automotive sector platforms such as IDIS for dismantling, IMDS for material declarations, and manufacturer platforms for spare part tracking.",ALIGNED,"VW explicitly advocates that existing systems like IDIS and IMDS should be used and developed rather than creating new systems, and that duplication and unnecessary burden should be avoided. The amendment directly responds to this position by requiring the Commission to base the passport's information sources on these exact existing platforms (IDIS, IMDS, and manufacturer platforms), aligning precisely with VW's stated proposals.",1,False
Volkswagen Aktiengesellschaft,6504541970-40,2023-12-04,8,0,8,312,Recital 28 a (new),recital,CJ45,0.846271,"The amendment inserts a new recital requiring manufacturers to provide mandatory, regular, secure, and accessible operating system (OS) updates for electric vehicles to safeguard long-term functionality, cybersecurity, and technological compatibility.",NOISE,"VW's expressed position focuses on the circularity vehicle passport, information systems (IDIS/IMDS), and end-of-life vehicle management — not on mandatory OS update obligations for electric vehicles. The org text does not express any directional stance on mandatory software/OS update requirements, so there is no substantive advocacy position that can be evaluated against this amendment.",1,False
Volkswagen Aktiengesellschaft,6504541970-40,2023-12-04,8,0,8,973,Article 13 – paragraph 3,article,CJ45,0.845211,"The amendment adds a sentence limiting the manufacturer's obligation to ensure accuracy and completeness of the circular vehicle passport to data available at the design, production, and type-approval stages, with subsequent updates governed by sector-specific regulations and no new indirect supply chain obligations implied.",ALIGNED,"VW explicitly advocated that ""a guarantee of completeness by the manufacturer should be limited to the time of placing the vehicle on the market"" and that completeness/up-to-date-ness ""can only be ensured by the manufacturer at the time the vehicle is produced and not later in its life."" The amendment directly responds to this by restricting the manufacturer's data obligation to the design, production, and type-approval stages, precisely the limitation VW sought.",1,False
Volkswagen Aktiengesellschaft,6504541970-40,2023-12-04,8,0,8,1503,Article 39 – paragraph 1,article,CJ45,0.844804,"The amendment changes the customs export verification criterion from checking whether a vehicle is considered ""roadworthy"" to checking whether it is considered ""an end-of-life vehicle,"" shifting the focus of the export control check.",NOISE,"The organisation's matched text does not address the customs export verification criterion at all; it focuses on the circularity vehicle passport, IDIS, and product passport obligations. While VW briefly mentions that cessation of a circularity vehicle passport should apply when a vehicle is legally exported, this is about passport lifecycle management, not about the specific roadworthiness vs. end-of-life vehicle distinction used in customs export checks. There is no substantive directional advocacy position on the subject of this amendment.",1,False
Volkswagen Aktiengesellschaft,6504541970-40,2023-12-04,8,0,8,989,Article 13 – paragraph 6 – subparagraph 1 – point b – point ii,article,CJ45,0.840102,The amendment adds a requirement that the storage and processing of information in the circularity vehicle passport must ensure compliance with intellectual property rights and data protection laws.,ALIGNED,"Volkswagen explicitly advocated that the circularity vehicle passport ""should not allow direct access to a vehicle's data, due to e.g. cyber security issues"" and that information sharing should be controlled via OEM backends, reflecting concerns about data protection and proprietary data. The amendment directly responds to this direction by adding explicit compliance requirements for intellectual property rights and data protection laws to the storage and processing of passport information.",1,False
Volkswagen Aktiengesellschaft,6504541970-40,2023-12-04,8,0,8,348,Recital 46,recital,CJ45,0.892782,"The amendment adds a requirement for producers to publish updated lists of collection points and authorised treatment facilities on their websites, and clarifies that delivery of an ELV remains free of charge even when the electric vehicle battery is missing, provided the last owner documents that the battery was handled by a professional operator.",UNDETECTABLE,"VW's position notes that authorised treatment facilities must accept ELVs free of charge even when the electric vehicle battery is missing, which is directly related to the amendment's clarification on free-of-charge delivery in that scenario — but VW does not specify whether the free-of-charge obligation should be conditional on documentation of battery handling by a professional operator (as the amendment requires), nor does it address the new obligation for producers to publish updated lists of collection points on their websites. The connection is real but the directional alignment is genuinely ambiguous.",1,False
Volkswagen Aktiengesellschaft,6504541970-40,2023-12-04,8,0,8,1246,Article 24 – paragraph 2,article,CJ45,0.886607,"The amendment expands free delivery to include collection points (not just authorised treatment facilities), adds a clause covering multi-stage type approval vehicles' non-approved parts as essential components, and conditions free delivery without an EV battery on proof that the battery was handed over to an authorised operator under Regulation (EU) 2023/1542.",NOISE,"The organisation's matched text merely describes and summarises what the original Article does (e.g., ""obliges authorised treatment facilities to accept ELVs free of charge, even in the case of vehicles missing the electric vehicle battery"") without expressing any specific directional advocacy position on whether free delivery should be extended to collection points, whether multi-stage vehicle parts should be included as essential components, or whether proof of battery handover should be required. This is descriptive background, not a substantive advocacy stance on the direction the amendment takes.",1,False
Volkswagen Aktiengesellschaft,6504541970-40,2023-12-04,8,0,8,344,Recital 44,recital,CJ45,0.884814,"The amendment adds that producers or producer responsibility organisations must ensure all end-of-life vehicles they placed on the market are collected, and clarifies that collection systems must ensure adequate availability of authorised treatment facilities and collection points across Member State territories.",UNDETECTABLE,"VW's position discusses the EPR framework and raises concerns about how producers/PROs can fulfil their obligations when treatment operators outside their collection network are active, and about the lack of tools to enforce compliance — but it does not take a clear directional stance on whether producers/PROs should bear an explicit guarantee to collect all vehicles they placed on the market, nor on the adequacy of territorial coverage of treatment facilities. The org's concerns are genuinely related to the amended provisions but it is unclear whether the amendment's specific additions (explicit collection guarantee by producers/PROs and adequate facility availability) satisfy, contradict, or simply ignore VW's expressed concerns.",1,False
Volkswagen Aktiengesellschaft,6504541970-40,2023-12-04,8,0,8,350,Recital 46,recital,CJ45,0.880991,"The amendment expands the responsibility for educational campaigns on end-of-life vehicle collection consequences to include EU and national institutions, in addition to producers and producer responsibility organisations.",NOISE,"The organisation's matched text is a descriptive summary of Chapter IV's requirements (EPR obligations, collection requirements, financial responsibilities) with no directional stance on who should conduct educational campaigns. There is no advocacy position expressed regarding the expansion or restriction of educational campaign responsibilities to EU/national institutions, making this purely background/descriptive content with no specific directional advocacy relevant to this amendment.",1,False
Volkswagen Aktiengesellschaft,6504541970-40,2023-12-04,8,0,8,1245,Article 24 – paragraph 2,article,CJ45,0.879408,"The amendment adds non-exhaustive examples of essential vehicle parts (catalytic converter, powertrain, chassis, wheels, SLI batteries, electric vehicle battery) and empowers the Commission to adopt delegated acts to determine and update the list of required parts and the fees authorised treatment facilities may charge for missing parts.",NOISE,"The organisation's matched text merely describes what the original Article does (last owner may deliver ELV free of charge unless essential parts are missing) without expressing any directional advocacy position on whether examples should be enumerated, whether a delegated act mechanism should be introduced, or how the list of essential parts should be defined or updated. The surrounding context focuses on EPR obligations, producer responsibilities, and collection systems — not on the specific changes the amendment makes. This is descriptive background, not a specific directional stance.",1,False
Volkswagen Aktiengesellschaft,6504541970-40,2023-12-04,8,0,8,345,Recital 44,recital,CJ45,0.869439,"The amendment removes the option for producers to ""set up or participate in"" collection systems, leaving only the obligation to ""participate in"" setting up collection systems, thereby weakening the producer's standalone responsibility.",ALIGNED,"Volkswagen explicitly argues that producers cannot properly fulfil extended producer responsibility obligations alone — noting they lack tools to enforce compliance and that treatment activities occur outside their systems — which aligns with the amendment's direction of reducing the producer's standalone obligation from ""set up or participate"" to merely ""participate in"" setting up collection systems. The amendment directly responds to VW's concern that producer requirements are too strong and that producers need support rather than sole responsibility.",1,False
Volkswagen Aktiengesellschaft,6504541970-40,2023-12-04,8,0,8,1176,Article 23 – paragraph 1 – subparagraph 1,article,CJ45,0.869108,"The amendment clarifies that collection systems must serve the purpose of transporting end-of-life vehicles to an authorised treatment facility, and replaces ""made available"" with ""placed"" on the market.",NOISE,"Volkswagen's position discusses broader concerns about EPR obligations, the role of treatment operators outside producer networks, and financial responsibilities, but does not express a specific directional stance on the clarification that collection systems are for the purpose of transporting ELVs to authorised treatment facilities, nor on the ""made available"" vs. ""placed"" on the market terminology change. The org text does not advocate for or against the specific direction this amendment takes.",1,False
Volkswagen Aktiengesellschaft,6504541970-40,2023-12-04,8,0,8,342,Recital 42,recital,CJ45,0.868979,"The amendment adds a new sentence to recital 42 stating that, since ELVs are often exported to third countries, the producer's responsibility should also cover collection and treatment costs incurred by waste management operators in those third countries.",NOISE,"Volkswagen's position focuses on the mechanics of EPR within the EU — such as the relationship between producers/PROs and authorised treatment facilities, enforcement tools, competition law concerns, and cost allocation — but does not express any directional stance on whether producer responsibility should or should not extend to third-country waste management operators. The organisation's text contains no substantive advocacy position on the cross-border/third-country dimension that the amendment introduces.",1,False
Volkswagen Aktiengesellschaft,6504541970-40,2023-12-04,8,0,8,1078,Article 20 – paragraph 1 – point a,article,CJ45,0.884632,"The amendment narrows the scope of collection costs that producers must finance by specifying that only costs incurred by ""contracted waste management operators"" are covered, rather than all waste management operators generally.",ALIGNED,"Volkswagen explicitly argues that producers can only fulfil EPR obligations properly if they have the right to organise waste through their own contracted/controlled channels, and expresses concern that the original text does not restrict obligations to contracted operators. The amendment's addition of ""contracted waste management operators"" directly responds to VW's position by limiting the producer's financial obligations to operators within their contracted network, aligning with VW's advocacy for tying EPR financing to contracted relationships.",1,False
