organisation,transparency_reg_id,source_date,meetings_total,meetings_commission,meetings_ep,amendment_number,target_element,target_type,committee,similarity_score,provision_effect,label,reasoning,n_chunks,conflict
European Aluminium,9224280267-20,2023-12-01,6,0,6,284,Recital 20 a (new),recital,CJ45,0.882843,"The amendment inserts a new recital mandating minimum recycled aluminium content targets (30% and 50%) in new vehicles, with specific sub-targets for aluminium recycled from end-of-life vehicles, and links these targets to design and treatment requirements enabling dismantling and separation to avoid down-cycling.",ALIGNED,"European Aluminium explicitly advocates for design-for-recycling requirements, quality aluminium recovery from ELVs, and alloy-family separation to enable product-to-product recycling — all of which align with the amendment's introduction of mandatory recycled aluminium content targets tied to design and treatment requirements that prevent down-cycling. The amendment directly responds to the organisation's call for stronger circularity provisions and quality recycling of aluminium from end-of-life vehicles, including the specific linkage between recycled content targets and dismantling/separation requirements.",1,False
European Aluminium,9224280267-20,2023-12-01,6,0,6,247,Recital 13,recital,CJ45,0.872424,"The amendment adds a sentence requiring the Commission to assess the need for a separate minimum reusability target, on top of the existing recyclability/recoverability rate methodology discussion.",UNDETECTABLE,"European Aluminium expresses a specific position that reporting on material recyclability alone is insufficient and that the focus should be on improving actual vehicle recyclability, suggesting support for stronger reusability/recyclability requirements. However, their position does not clearly advocate for or against a separate standalone reusability target specifically — they focus on design-for-recycling and aluminium scrap quality rather than the metric structure of reusability targets, making it genuinely unclear whether this particular amendment direction satisfies their advocacy.",1,False
European Aluminium,9224280267-20,2023-12-01,6,0,6,249,Recital 13,recital,CJ45,0.870788,"The amendment inserts the phrase ""by implementing design-out-waste principle"" into the recital describing how vehicles should be designed and manufactured for circularity, adding an explicit reference to the design-out-waste principle.",ALIGNED,"European Aluminium explicitly advocates for vehicle design that enables improved recyclability and circularity (""design for recycling""), stressing that vehicle manufacturers should integrate circularity approaches into design. The amendment's insertion of the ""design-out-waste principle"" directly reinforces this design-focused circularity direction that European Aluminium advocates for, making the amendment aligned with their expressed position.",1,False
European Aluminium,9224280267-20,2023-12-01,6,0,6,248,Recital 13,recital,CJ45,0.870782,"The amendment removes the sentence conferring implementing powers on the Commission to establish the methodology for calculating reusability, recyclability, and recoverability rates, leaving only the interim provision that ISO 22628:2002 applies until a new methodology is established.",NOISE,"European Aluminium's position focuses on vehicle design for circularity, aluminium scrap quality classification, and ELV treatment — it does not express any directional stance on whether the Commission or independent experts should be responsible for developing the calculation methodology for reusability/recyclability/recoverability rates. The matched text contains no substantive advocacy on this governance question.",1,False
European Aluminium,9224280267-20,2023-12-01,6,0,6,1926,Annex VII – Part G – point 3 a (new),annex,CJ45,0.859657,The amendment inserts a new requirement that aluminium must be sorted at minimum into a cast alloys fraction (per EN 1706:2020) and a wrought alloy fraction (per EN 573-3:2019).,ALIGNED,"European Aluminium explicitly advocated for a minimum requirement prescribing the separation of aluminium scrap into at least two alloy families — cast alloys as defined in EN 1706:2020 and wrought alloys as defined in EN 573-3:2019 — which is precisely what this amendment introduces. The organisation's position is highly specific, referencing the exact same standards and the same two-fraction minimum, making this a direct match in both subject and direction.",1,False
European Aluminium,9224280267-20,2023-12-01,6,0,6,1915,Annex VII – Part G – point 2,annex,CJ45,0.869693,"The amendment replaces a requirement for a sample analysis report on treatment fractions with specific, binding quality requirements for output fractions, including a requirement that aluminium be sorted into a minimum of four distinct fractions defined by their chemical composition (silicon, copper, iron, magnesium, zinc content).",ALIGNED,"European Aluminium explicitly advocated for prescribing minimum classification of aluminium scrap into alloy families in the Regulation, stating that ""at least two aluminium alloy families shall be prescribed"" and ideally up to 10 families. The amendment directly responds to this by introducing mandatory sorting of aluminium into at least four compositionally defined fractions, which moves in the exact direction the organisation advocated — from a reporting/analysis requirement to binding, specific quality output standards for aluminium fractions.",1,False
European Aluminium,9224280267-20,2023-12-01,6,0,6,806,Article 6 – paragraph 4 – subparagraph 2,article,CJ45,0.856423,"The amendment expands the scope of recyclable content that can count toward the minimum recycled share by adding ""pre-consumer"" waste alongside the existing ""post-consumer"" waste requirement.",NOISE,"European Aluminium's position focuses on improving the quality and classification of aluminium scrap recovered from end-of-life vehicles (post-consumer), specifically advocating for separation into alloy families and mandatory dismantling before shredding. Their text does not address the distinction between pre-consumer and post-consumer waste sources, nor do they advocate for including or excluding pre-consumer scrap from recycled content calculations. The amendment's specific directional change — adding pre-consumer waste as an eligible source — finds no corresponding advocacy in the org's position.",1,False
European Aluminium,9224280267-20,2023-12-01,6,0,6,805,Article 6 – paragraph 4 – subparagraph 2,article,CJ45,0.856328,"The amendment expands the scope of recycled content that counts toward the minimum share requirement by adding pre-consumer waste alongside post-consumer waste, whereas the original text only referenced post-consumer waste.",UNDETECTABLE,"European Aluminium's position focuses specifically on improving the quality of aluminium recycling from end-of-life vehicles (post-consumer waste), including alloy family separation and dismantling before shredding — all of which relate to post-consumer scrap. The amendment adds pre-consumer waste as an eligible source for meeting minimum recycled content requirements, which is a distinct directional change. The org's position does not address pre-consumer waste at all, making it genuinely unclear whether they would support or oppose broadening the scope to include it (it could dilute the focus on post-consumer quality recycling they advocate for, or it could be seen as a welcome flexibility). The connection to the amendment's specific direction is real but ambiguous.",1,False
European Aluminium,9224280267-20,2023-12-01,6,0,6,804,Article 6 – paragraph 4 – subparagraph 2,article,CJ45,0.855586,"The amendment expands the list of materials for which the Commission may set minimum recycled content requirements by adding copper, nickel, and cobalt to the existing list (which already included aluminium, magnesium, neodymium, dysprosium, praseodymium, terbium, samarium, and boron).",NOISE,"European Aluminium's position is focused specifically on improving the quality and classification of aluminium scrap recycling (e.g., separating alloy families), not on expanding the list of materials covered by minimum recycled content requirements. The amendment adds copper, nickel, and cobalt to the scope — materials entirely outside the organisation's expressed advocacy. The org's position does not address whether additional non-aluminium materials should or should not be included in this provision.",1,False
European Aluminium,9224280267-20,2023-12-01,6,0,6,366,Recital 55,recital,CJ45,0.884693,"The amendment clarifies that dismantling must occur in a non-destructive way, restricts the exception for deviating from mandatory removal to only cases where there is no technical potential for reuse/repair/remanufacturing/refurbishing, and adds that semi-automated destructive removal is only permitted when parts cannot fulfil reuse/remanufacturing/refurbishment purposes.",ALIGNED,"European Aluminium explicitly supports mandatory dismantling before shredding to preserve high-quality aluminium scrap and enable alloy-family separation, and advocates for strong requirements around this process. The amendment strengthens the mandatory dismantling regime by narrowing the exception (only when there is no technical potential for reuse/repair/remanufacturing/refurbishing) and adding quality-focused conditions (non-destructive removal), which directly aligns with European Aluminium's position that quality recycling and separation of components should be prioritised and that the mandatory dismantling requirement should be robust.",1,False
European Aluminium,9224280267-20,2023-12-01,6,0,6,367,Recital 55,recital,CJ45,0.883937,"The amendment narrows the conditions under which deviation from mandatory pre-shredding removal is allowed, by adding an explicit requirement that parts and components must lack reuse/repair/remanufacturing/refurbishing potential, and references new criteria in Annex VII Part G for shredding with other waste and output fraction quality.",OPPOSING,"European Aluminium strongly advocates for mandatory dismantling before shredding as a core requirement to preserve aluminium scrap quality and enable alloy-family separation. The amendment, while tightening the conditions for deviation, still preserves and arguably legitimises the exception pathway by adding explicit criteria (Annex VII Part G) for when shredding without prior removal is permitted — moving in the direction of formalising and enabling the derogation. This runs counter to European Aluminium's position, which supports mandatory dismantling before shredding with no indication of support for broadening or codifying exceptions to that requirement.",1,False
European Aluminium,9224280267-20,2023-12-01,6,0,6,368,Recital 55,recital,CJ45,0.883673,"The amendment clarifies that parts and components that cannot fulfil reuse/remanufacturing/refurbishment purposes may be removed destructively (semi-automated), and restricts the exception to mandatory removal only to cases without technical potential for reuse, repair, remanufacturing or refurbishing, while adding criteria for shredding with other wastes in Annex VII Part G.",UNDETECTABLE,"European Aluminium strongly supports mandatory dismantling before shredding of selected components (Annex VII Part C) to preserve aluminium alloy quality, which is consistent with the amendment's overall framework. However, the amendment's specific changes — allowing destructive semi-automated removal for parts with no reuse potential and narrowing the exception to cases without technical reuse/repair potential — neither clearly advance nor contradict European Aluminium's position, which focuses on ensuring separation of aluminium alloy families and expanding the list of components to be dismantled, rather than on the method of removal or the scope of exceptions.",1,False
European Aluminium,9224280267-20,2023-12-01,6,0,6,369,Recital 55,recital,CJ45,0.877785,"The amendment removes the qualifier ""in certain exceptional cases"" from the deviation allowance for mandatory pre-shredding removal, and adds a reference to Part G of Annex VII containing criteria for shredding with other wastes and limit values to enhance output fraction quality.",UNDETECTABLE,"European Aluminium strongly supports mandatory dismantling before shredding and advocates for high-quality aluminium scrap separation, but their position does not clearly address whether the deviation from mandatory removal should be broadened (by removing ""in certain exceptional cases"") or whether adding quality criteria in Annex VII Part G satisfies or contradicts their goals. The amendment both slightly broadens the deviation allowance (removing the ""exceptional cases"" qualifier) and adds quality safeguards (Part G criteria), making the net direction relative to European Aluminium's position genuinely ambiguous.",1,False
European Aluminium,9224280267-20,2023-12-01,6,0,6,792,Article 6 – paragraph 4 – subparagraph 1 – point a,article,CJ45,0.850636,"The amendment adds glass and rubber to the list of materials (alongside aluminium, magnesium and their alloys) that must be recycled from post-consumer waste and incorporated into vehicle types.",NOISE,"European Aluminium's position is focused exclusively on aluminium scrap quality, dismantling requirements, and aluminium-specific recycling concerns. The amendment adds glass and rubber to the recycled content provision, which is entirely outside the scope of European Aluminium's advocacy. The organisation expresses no position on whether glass or rubber should be included in or excluded from this provision.",1,False
European Aluminium,9224280267-20,2023-12-01,6,0,6,791,Article 6 – paragraph 4 – subparagraph 1 – point a,article,CJ45,0.850636,"The amendment adds glass and rubber to the list of materials (alongside aluminium, magnesium and their alloys) that must be recycled from post-consumer waste and incorporated into vehicle types.",NOISE,"European Aluminium's position is focused exclusively on aluminium scrap quality, dismantling requirements, and aluminium-specific recycling concerns. The amendment adds glass and rubber to the recycled content provision, which is entirely outside the scope of European Aluminium's advocacy. The organisation expresses no position on whether glass or rubber should be included in or excluded from such requirements.",1,False
European Aluminium,9224280267-20,2023-12-01,6,0,6,795,Article 6 – paragraph 4 – subparagraph 1 – point a,article,CJ45,0.856936,The amendment adds copper to the list of materials (alongside aluminium and magnesium) that qualify for recognition when recycled from post-consumer waste and incorporated into vehicle types.,NOISE,"The matched org text is a technical annex proposing alloy families for aluminium recycling separation, not an advocacy position on whether copper should be added to the list of qualifying recycled materials. The reference to copper in the annex is incidental (as a compositional element within aluminium alloy classifications), not a directional stance on including copper as a standalone material in the recycled content provision. The org's substantive advocacy in the matched chunk does not address the direction of this amendment.",1,False
European Aluminium,9224280267-20,2023-12-01,6,0,6,582,Article 3 – paragraph – point 35 c (new),article,CJ45,0.848727,"The amendment inserts a new definition of 'mono material metal component' as a component composed of 90% by weight of a unique metal, with different alloys of the same metal counted as a unique metal.",ALIGNED,"European Aluminium explicitly recommended adding a definition of 'mono-metal' to the regulation, proposing the exact formulation that ""a part is composed for X% in weight of a unique metal, with different alloys of the same metal considered as being a unique metal,"" and suggested 90% as the starting threshold. The amendment directly adopts this definition and threshold, matching the organisation's specific advocacy.",1,False
European Aluminium,9224280267-20,2023-12-01,6,0,6,1835,Annex VII – Part C – point 16 a (new),annex,CJ45,0.848654,The amendment inserts a new requirement to dismantle any mono-material non-ferrous metal components (except engine and gearbox) heavier than 10 kg before shredding.,OPPOSING,"European Aluminium explicitly advocates for lowering the weight threshold for dismantling mono-metal parts to 4 kg (from a higher threshold), whereas the amendment sets the threshold at 10 kg — a higher threshold than what the organisation recommended. The amendment moves in the opposite direction from the org's specific positional ask on the weight threshold.",1,False
European Aluminium,9224280267-20,2023-12-01,6,0,6,1837,Annex VII – Part C – point 17,annex,CJ45,0.847978,"The amendment narrows the scope of mandatory dismantling for ""mono-material metal components heavier than 10 kg"" by restricting it to non-ferrous metals only and explicitly excluding engines and gearboxes.",OPPOSING,"European Aluminium explicitly advocates for mandatory dismantling of engines before shredding (citing aluminium alloy quality benefits) and supports the overall dismantling requirements in Annex VII Part C, while suggesting additions and clarifications rather than exclusions. The amendment removes engines and gearboxes from mandatory dismantling requirements, which directly contradicts European Aluminium's stated position that engine removal before shredding is a ""clear example"" of a beneficial mandatory dismantling requirement.",1,False
European Aluminium,9224280267-20,2023-12-01,6,0,6,1838,Annex VII – Part C – point 17,annex,CJ45,0.847328,The amendment narrows point 17 from covering all mono-material metal components heavier than 10 kg to covering only non-ferrous mono-material metal components (excluding engine and gearbox) heavier than 10 kg.,UNDETECTABLE,"European Aluminium's position on point 17 focuses on clarifying the definition of ""mono-metal"" and lowering the weight threshold, not on whether the scope should be restricted to non-ferrous metals or whether engines/gearboxes should be excluded. While the restriction to non-ferrous metals is broadly consistent with aluminium industry interests, the org's specific advocacy does not address this directional change, making it genuinely unclear whether this amendment satisfies, contradicts, or ignores their stated position.",1,False
European Aluminium,9224280267-20,2023-12-01,6,0,6,1839,Annex VII – Part C – point 17,annex,CJ45,0.847328,"The amendment narrows the scope of ""mono-material metal components"" requiring dismantling before shredding by restricting it to non-ferrous metals only and explicitly excluding engines and gearboxes.",UNDETECTABLE,"European Aluminium's position focuses on clarifying the definition of ""mono-metal"" parts and adjusting the weight threshold, but does not specifically advocate for restricting point 17 to non-ferrous metals only or for excluding engines and gearboxes from this catch-all category. While their broader context discusses aluminium (a non-ferrous metal) and engine removal, their specific ask on point 17 is about definitional clarity and threshold adjustments — not about limiting the provision to non-ferrous metals or carving out engines/gearboxes. It is genuinely unclear whether this directional narrowing satisfies, contradicts, or is orthogonal to their stated position.",1,False
European Aluminium,9224280267-20,2023-12-01,6,0,6,803,Article 6 – paragraph 4 – subparagraph 2,article,CJ45,0.864071,"The amendment changes the Commission's power to adopt delegated acts on minimum recycled content shares from discretionary (""is empowered to"") to mandatory (""shall""), adds glass, rubber, nickel, and cobalt to the list of materials covered, and sets a specific implementation date of 72 months after entry into force.",NOISE,"The organisation's matched text focuses on dismantling requirements for heat exchangers, the circularity vehicle passport, and the bill of materials fields — not on the mandatory recycled content provisions or the specific materials list being expanded in this amendment. While European Aluminium is broadly engaged with ELV recycling, their expressed position does not advocate for or against making the delegated act mandatory, adding glass/rubber/nickel/cobalt to the recycled content scope, or setting a 72-month implementation date, so there is no substantive directional stance that maps onto this amendment.",1,False
European Aluminium,9224280267-20,2023-12-01,6,0,6,802,Article 6 – paragraph 4 – subparagraph 2,article,CJ45,0.862411,"The amendment expands the list of materials for which the Commission may establish minimum recycled content shares by adding glass, rubber, nickel, and cobalt to the existing list (which already included aluminium, magnesium, rare earths, and boron), and adds a date placeholder for the delegated act deadline.",NOISE,"European Aluminium's position focuses on mandatory dismantling of heat exchangers, quality requirements for aluminium scrap, and the circularity vehicle passport — not on expanding or contracting the list of materials subject to minimum recycled content obligations. The organisation does not advocate for or against adding glass, rubber, nickel, or cobalt to the delegated-act scope, so the amendment's directional change does not respond to any specific position the organisation expressed.",1,False
European Aluminium,9224280267-20,2023-12-01,6,0,6,807,Article 6 – paragraph 4 – subparagraph 2,article,CJ45,0.857763,"The amendment changes the Commission's power from adopting delegated acts to establish minimum recycled content shares (a binding, autonomous regulatory tool) to merely forwarding a legislative proposal to the Council and Parliament if appropriate (a weaker, conditional legislative pathway).",NOISE,"The organisation's matched text focuses on dismantling requirements, heat exchanger treatment, shredding processes, and the circularity vehicle passport — not on the procedural mechanism (delegated acts vs. legislative proposal) by which minimum recycled content shares for aluminium are established. The org does not express any directional stance on whether the Commission should act via delegated acts or via a conditional legislative proposal to Parliament and Council, so there is no substantive advocacy position that maps onto the direction of this amendment.",1,False
European Aluminium,9224280267-20,2023-12-01,6,0,6,784,Article 6 – paragraph 3 a (new),article,CJ45,0.870747,"The amendment inserts a new provision requiring the Commission to conduct a feasibility study on minimum recycled steel content within 23 months, and to submit a legislative proposal (via regular amendment, not implementing act) to introduce minimum recycled steel levels if appropriate.",ALIGNED,European Aluminium explicitly supports a feasibility study before deciding on recycled content requirements and specifically advocates for a 23-month timeline (rather than 35 months) for delivery of the study — exactly the timeline reflected in the amendment. The amendment's requirement that any introduction of minimum recycled content levels go through a regular legislative amendment (rather than a Commission implementing act) also aligns with European Aluminium's call for maximum stakeholder involvement in such decisions.,1,False
European Aluminium,9224280267-20,2023-12-01,6,0,6,292,Recital 22,recital,CJ45,0.860264,"The amendment expands the list of materials subject to minimum recycled content requirements by adding copper, nickel, and cobalt alongside the existing materials (aluminium, magnesium, neodymium, etc.), and changes the implementing powers from ""implementing"" to ""delegating"" powers.",OPPOSING,"European Aluminium explicitly advocates for a fact-based, feasibility-study-driven approach before setting minimum post-consumer recycled content requirements, and specifically calls for the same timeline for entry into force across all materials to avoid distortive effects on material choice. The amendment expands the scope of mandatory recycled content requirements to additional materials (copper, nickel, cobalt) without the feasibility study European Aluminium demands, and by adding more materials asymmetrically it risks creating exactly the kind of distortive effect on material choice that European Aluminium warned against — moving in the opposite direction from their cautious, evidence-first stance.",1,False
European Aluminium,9224280267-20,2023-12-01,6,0,6,655,Article 5 – paragraph 5,article,CJ45,0.869326,"The amendment adds a requirement that ECHA's report on exemption alternatives must be based on a comprehensive consultation with stakeholders and industry experts, whereas the original text imposed no such consultation requirement.",ALIGNED,"European Aluminium explicitly advocated for improving stakeholder involvement in the exemption amendment process, recommending longer consultation periods and the ability to comment on draft ECHA assessments before finalisation. The amendment directly responds to this by mandating comprehensive consultation with stakeholders and industry experts as part of ECHA's report preparation, moving the text in exactly the direction the organisation advocated for.",1,False
